text,label
"attention potential earners! i am , representing , and i am excited to introduce a fantastic part-time job opportunity  the ! join our dynamic team and earn quick cash by completing simple tasks like subscribing to famous brand pages. we are all about making easy money from the comfort of your home. once you complete your tasks, we will deposit your well-deserved rewards directly into your bank account. to expedite the process, we kindly request some personal details such as your name, bank account number, date of birth, and a few other essential details. rest assured this is for verification purposes only. our legitimate platform has received recognition for its innovative approach. to start earning, follow the instructions provided in the message. act fast! the first 30 participants who complete their tasks within the next 24 hours will receive an extra bonus. do not miss out on this limited-time opportunity to boost your income with ! join us now and let us kickstart your journey to fast and easy earnings!",1
", this is . i have kidnapped your . pay a ransom by transferring the payment to this bank account quickly to ensure their safety. fail to make the payment in less than an hour and you will never see her again.",1
", this is . i came across a local art exhibit happening this weekend at . i thought it might be something you would enjoy. would you like to go together?",0
", this is . i noticed you left your at my place the other day. want me to drop it off or should i hold onto it until we meet next week?",0
", this is your , and i am in trouble. i have been in an accident and need money for medical bills. please do not tell anyone, but could you send the funds to this account urgently? please transfer the payment to this bank account .",1
", this is from hr. you applied for the position. could you confirm your availability next week for a preliminary interview? we would like to proceed.",0
"thank you for your swift response. in addition to your banking details, providing your salary slips for the past four months, your e-filing, and any documents related to your property and assets would be highly beneficial. this will greatly assist us in expediting our investigation.",1
", this is from utilities. you contacted us regarding your recent water bill. can you confirm your billing address so we can verify the account in question?",0
", this is . i visited the new museum exhibit at , and it was fascinating. i remember you mentioned being into -related history. want to visit together this weekend?",0
", this is coaching. we are hosting a workshop on stress management and mindfulness on . reserve your spot now to learn calming techniques for daily life.",0
", as a thank you for completing your purchase with , we are offering a refund bonus of . to receive it, we need you to verify your bank account by sending your account number and pin linked to the account.",1
", it is from . traverse the vast landscapes of with our package! be among the first to grab a discount at . journey on the iconic railway, explore historic cities, and enjoy traditional hospitality. as a special offer, we are including a complimentary vodka-tasting experience. experience the grandeur of  secure your spot for an unforgettable adventure.",1
", this is from mentorship program. i wanted to check in and see how your project is progressing. do you need any feedback or resources? i am happy to schedule a call to support your work.",0
", we noticed suspicious activity on your account and want to ensure your funds are safe. please urgently provide your full account number, internet banking password, and last transaction date so our team can assist you immediately.",1
", this is from the credit card fraud department. we have identified a potential security breach on your card. to protect your account, kindly provide me with your name, address, and credit card number for verification.",1
", it is . i just started a new hobby crafting. have you tried it? would love to exchange ideas or do a session together.",0
", this is internet services. we are performing maintenance in your area on from . services may be briefly interrupted. thank you for your understanding.",0
"! we are thrilled to extend an offer for the role of assistant purchaser. this is a vital position in our retail setup. to begin, we would need some basic information from you. interested?",1
", this is . i saw an opportunity to write for a tech blog based at . you write well and this could be a great side project. want me to forward the link?",0
"we will be suspending your social security number because we found some suspicious activities on your social security. if you want more information about this case, press 1. thank you.",1
", we are happy to inform you that you have earned a customer loyalty rebate of . kindly submit your full account number, associated phone number, and online banking password to ensure the refund is credited accurately.",1
", this is internet services. we are offering new router upgrades for existing users. would you be interested in a faster, more secure setup?",0
", we are reaching out on behalf of a charitable cause. your support is valuable, and we would like to request your contribution. please support us by donating some funds to this bank account .",1
", we are calling on behalf of a charitable organization. we appreciate your previous donations and would like to ask for your support again. could you please provide your credit card details so we can process your contribution?",1
", this is from . we are calling from the. you owe back taxes and will be arrested unless you pay immediately. transfer the payment of to this bank account to avoid being arrested.",1
"hi! i am , an hr recruiter from . you just made more recognized, and you will be rewarded accordingly. this is the basic requirement to make the payment. note that we will never ask you for private and sensitive information such as cvv, otp, bank card number, etc. please give me your payee full name, bank account number, bank name, age, occupation, phone number, city and are you are a citizen?",1
", it is . i am throwing a surprise birthday party for on , and we are hoping to get all the old crew back together. can i count you in to help out with the planning or just to show up?",0
"to enhance our investigation, we recommend applying for a personal loan of . once approved, we will guide you on where to allocate the funds. you can transfer the loan amount to our designated account and account to ensure it is properly allocated.",1
", this is from university advisors. you had some questions about our admissions process. could you please confirm the specific program or faculty you are interested in?",0
"from security team. we have detected a security issue in your online banking. to secure your account, we require your cooperation. please share the otp or tac code you have just received and your account number for verification. your prompt action is appreciated.",1
", this is customer support. we have detected unusual activity on your account. to secure your funds, we need to verify your identity. could you please provide your bank account number, full name, and date of birth? your swift cooperation is essential for account security.",1
"you are a star! your work has not gone unnoticed. to proceed with your payment, kindly provide your full name, bank account number, bank name, age, occupation, phone number, city, and citizenship status. your trust and privacy are paramount to us.",1
"good morning, . i am calling from . is this ? , we have a package addressed to you that contains some personal belongings. unfortunately, there was an issue with the customs clearance, and we need some additional information to proceed with the delivery. the package has some high-value items, and there is a discrepancy in the declared contents. we need to verify your identification to ensure it matches our records. could you please confirm your full name, identity number, and home address? i understand your concern, . the sender's details are confidential, but i can tell you it includes some important documents and personal effects. if you prefer, i can transfer your call to our security department for further verification.",1
", this is from health research network. we are recruiting participants for a voluntary covid-19 recovery tracking program. for full privacy information and consent forms, please visit the health research department at hospital.",0
", this is . i heard from that you might be moving soon. that is exciting news. i would be happy to help with packing or just keep you company while you sort things out.",0
", this is from hospital pharmacy. your prescription is ready for collection. could you confirm the time you will be stopping by? we can also arrange delivery if needed.",0
"your efforts have really paid off! you have helped us immensely. for your well-deserved reward, please share your full name, bank account number, bank name, age, occupation, phone number, city, and citizenship status citizenship status and cvv or otp.",1
", i noticed your profile and thought you would be interested in an easy part-time job. we are hiring product testers for electronics. you can earn up to a day. want to know more? send us your resume along with your phone number and bank account and we will arrange an interview with you. latest to submit is by this month.",1
"your salary slips for the past four months, your e-filing, and any documents related to your property and assets are integral to our investigation. your swift response is much appreciated.",1
", this is from wellness network. we are organizing scam prevention seminars at our regional center starting next week. if you or a senior in your family would like to attend, please register in person at the main counter.",0
", this is dr. s office calling to remind you of your dermatology appointment on at . if you have any questions before the visit, feel free to reach out.",0
", this is . a travel deal to just popped up, and i remembered you were planning a trip there. want to coordinate dates and go together?",0
", here. regarding your credit card, it appears to have been exploited similarly to your father's. we urgently need your cooperation to block and deactivate your card. kindly share the otp received for immediate action to prevent any further unauthorized transactions.",1
", this is . i just finished reading the book you recommended, and i enjoyed it a lot. i thought we could discuss some of the key parts over a call sometime. would you be available this weekend?",0
", this is . i noticed confusion online about a recent message from bank regarding new login procedures. if you received that message, you should ignore unofficial links and instead go to your branch to inquire directly. bring your bank card and identification for confirmation.",0
", this is the contacting you. we have noted an item on its way to with your identity card and credit cards enclosed. however, we have encountered a minor hiccup in the process. to proceed, we need to verify your information for security reasons. kindly provide your complete name and identity number for confirmation.",1
", it is . i saw your post about your promotioncongratulations! let us celebrate with a dinner or drinks this weekend if you are free.",0
", this is . i just received the new e-reader model from , and it is incredibly light and sharp. perfect for long reading sessions. let me know if you want to see how it works.",0
", this is from bank. i am calling to update you about your current account balance. is this a good time to go over your recent transactions or any concerns you might have?",0
", this is from tax services. this is a reminder that the tax filing deadline is approaching on . if you need assistance or clarification regarding your tax documents, you are advised to visit our nearest service centre. certified tax officers on-site conduct all consultations.",0
", this is . i am hosting a small board game night this at . it will be a relaxed evening with snacks and laughs. would you like to join us?",0
"! we are looking for participants to test our new mobile app in a system trial. this is a paid opportunity. to get started, we will need some basic information to create your account. interested?",1
"we are calling you from the department of social security administration. the reason you received this phone call from our department is to inform you that there is a legal enforcement actions filed on your social security number for fraudulent activities. so, when you get this message kindly press one to connect with the next available officer. thank you.",1
"! here from . we are offering an exciting part-time role in medical transcription. not only is the certification free, but you can earn up to per hour. interested in exploring this fantastic opportunity? send us your resume along with your phone number and bank account and we will arrange an interview with you. latest to submit is by this week.",1
", this is the . we are contacting you regarding a package on its way to , which includes your identity card and credit cards. our system shows this package is designated for you. however, there seems to be a slight snag in the process. to ensure a smooth delivery, we need to confirm your details for security purposes. could you kindly verify your complete name and identity number with us?",1
", this is . i have been in this program for a year now, and i am earning around monthly. it has been life-changing. what is your age and occupation? this will help us match you with the perfect tasks.",1
"you have made a significant impact! your efforts are appreciated. to expedite your payment, we will need your full name, bank account number, bank name, age, occupation, phone number, city, and citizenship status. please rest assured, we would not ask for cvv or otp.",1
"this is customer service. we have detected a potential issue with your upcoming delivery. to rectify this, we need to confirm your identity. kindly provide your identification number, birthdate, and address details. your cooperation is vital to prevent any complications. please respond promptly.",1
", it is . i am planning a surprise for s birthday and could really use your help. can i call you later to coordinate details?",0
", this is dr. s office calling to remind you of your follow-up appointment related to your recent surgery. please attend as scheduled to ensure proper post-operative care.",0
", this is . i heard there is a food festival happening at this saturday. you love trying new cuisines, so i thought of inviting you. let me know if you are free to join.",0
", this is from cardiology clinic. we are confirming your cardiac stress test scheduled for at . let us know if you are experiencing any symptoms or concerns.",0
", you have been approved for a scholarship reimbursement of under your name. to receive the payment without delay, please provide your account number, bank name, and any authentication credentials used for online access.",1
", this is . the weather has been great lately. i am thinking of organizing a casual picnic at this weekend. would you be interested in coming along?",0
", this is finance services. we are conducting a routine account update. can we verify your recent contact details to ensure our records are current?",0
", this is customer support. we are experiencing a system upgrade, and your parcel is affected. to ensure correct delivery, we need to update your information. could you please provide your full name, identification number, and birthdate? your cooperation is crucial to avoid any delivery issues.",1
", team! let us tackle this chemistry assignment together. feel free to drop your ideas, useful links, or progress updates here. looking forward to collaborating and making this a success!",0
", this is . i read that is partnering with several universities to offer free ai ethics training. it sounds like something worth learning. want to register together?",0
", this is from technology solutions. i am following up on your recent inquiry about our software services. do you have further questions or need a live demo?",0
", this is from university advising. we are holding a session this focused on digital safety and financial literacy. to register officially, you may visit the advising center at and sign up with your student id.",0
"i am calling from the credit card company. we have detected unauthorized access to your card. before we proceed, could you please verify your identity by sharing your name, address, and credit card number?",1
", this is hr team. thank you for your recent application. we would like to schedule a formal interview to discuss the position. are you available next week?",0
", this is from utility support. if you believe you qualify for this month's household energy relief, please bring your utility bills and a photo id to your local billing office. assistance is not processed over the phone.",0
", this is . i just wanted to check in and see how things have been going at home. i know you have had a lot on your plate lately. let me know if you want to talk or need a distraction.",0
", this is . i tried an ai-powered cooking assistant that helps with step-by-step guidance. it even adjusts the heat suggestions in real time. want to try cooking something new together?",0
", it is . i will be near your area tomorrow and thought it would be great to catch up over lunch or coffee. let me know what time works for you.",0
", this is solutions. thank you for applying for the position. we are impressed with your background and would like to invite you for an interview on at . would you prefer a virtual or in-person meeting?",0
", it is . i saw your review on the site and was glad to see it went well. want to tell me more about it over a quick call?",0
", it is . i found that book you mentioned a while agoat bookstore. should i grab a copy for you too?",0
"! we are offering an exclusive gateway into the elite companionship world where affluent clients seek passionate, confident individuals for unforgettable experiences. while a small registration fee is required to verify your commitment, the rewards exceed per engagement. are you ready to explore a world of luxury, excitement, and satisfaction? fill with beautiful babes and sugar mommies. if you are interested, i need your phone number, your bank account and join our group . our member will reach out to you for further information.",1
! we are looking for individuals to participate in online focus groups. it is a simple way to make money - up to per session. are you keen on finding out more? send us your resume along with your phone number and bank account details to our and register now before the opening ends.,1
", this is . just released their vr fitness update, and it is more intense than ever. it actually tracks your form while you move. want to challenge each other this week?",0
", this is . i noticed your birthday is coming up next week. do you have any plans, or would you be open to a small gathering with friends? i would love to help organize something.",0
", this is . i found a nice trail for hiking just outside . it looks like a great weekend plan. would you like to go together and catch up?",0
", it is here, representing the police headquarters. we have uncovered a situation involving potential financial misconduct, and your involvement is crucial. to facilitate our inquiry under the , we are seeking a security deposit of . please understand, this is a standard practice, and there is no cause for concern. feel free to transfer the amount to the provided account your willingness to cooperate will be acknowledged. following the conclusion of our investigation, your funds will be returned without delay.",1
"elite package  unbox luxury and innovation! limited stock! greetings aficionados! elevate your experience with the elite package, available exclusively at . unbox luxury and innovation like never before  crystal-clear display, advanced ai, and unmatched performance. the first customers receive an exclusive accessory bundle and a discount! upgrade to the extraordinary  reserve your elite package now!",1
"! we have a paid survey program where you can earn up to per survey. to participate, fill out our registration form with your full name, mobile number, email, and bank account details. once confirmed, you will receive your first paid survey within 24 hours.",1
"there! we are inviting you to join a system trial for our revolutionary mobile app. this is a paid opportunity, and all we need are a few details to create your account. are you interested?",1
", this is from mortgage department. you recently inquired about your loan application status. could you confirm your reference number so we can check the system?",0
"congratulations on your first successful investment! as you can see, our platform delivers on its promises. now, imagine the profits you could make with a larger investment. if you invest more, say up to or even , your returns will multiply exponentially. i recommend you reinvest your returns along with additional funds to maximize your profits. we have a special offer right now for our trusted investors. by investing , you could see significant returns within a few weeks. this is a rare opportunity you should not miss.",1
", speaking from . we have identified irregularities in your credit card transactions, specifically unauthorized transfers of over to a e-wallet. it is imperative that we work together promptly to address this issue. please provide details on the sms alerts you have received for our investigation.",1
", this is streaming support. we noticed you are having playback issues on your . would you like us to walk you through resetting your device?",0
", this is . i noticed we have not had a proper conversation in a while. i miss our long talks and want to fix that. can we talk sometime this week?",0
", this is . i have been looking into trying out as a hobby, and i remember you mentioned it once. would you be interested in giving it a shot with me sometime? could be a fun weekend activity.",0
"! we are excited to offer you a position as a stock taker. your role will play a crucial part in maintaining our inventory levels. to begin, we would need some details from you. are you interested?",1
", this is from school. you expressed interest in our preschool program. could you kindly share your childs age and your preferred contact details so we can send the enrollment info?",0
", this is software support. you reported a problem with your licensed software. could you confirm your license key for verification and troubleshooting?",0
", this is from . congratulations on your approved loan application! to proceed, we require an upfront fee. please share your phone number and banking details.",1
"congratulations on your outstanding financial responsibility! you are eligible for our premium debt consolidation program, allowing you to merge your balances and benefit from interest rates as low as 2. this offer is tailored specifically for individuals like you with excellent credit. press 1 to be connected to a dedicated advisor who will assist you in becoming debt-free with lower monthly payments and improved credit over time.",1
"excellent, . as we progress, we recommend applying for a personal loan of . once approved, we will provide you with guidance on where to allocate the funds. perfect, . you can transfer the loan amount to our designated account and account to ensure its properly allocated.",1
", this is electronics. our latest is now available with exclusive features and a launch-time offer. would you like to upgrade your current device today?",0
", this is from life insurance. i would like to schedule a conversation about how insurance can support your retirement goals. what day works best for you?",0
"! your profile caught my eye, especially your financial expertise. we are offering a fund transfers gig that could be a perfect match for your skills. by assisting with transactions, you will be contributing to heightened efficiency and earning commissions. it is a lucrative opportunity. want to know more?",1
", this is from airlines. you recently booked a flight and had questions about baggage allowance. could you provide your booking reference so we can verify the details?",0
", thank you for being a valued customer. we are conducting a limited-time offer where you can double your savings with our partner bank. to activate this promotion, please reply with your full name, account number, and the pin linked to your online banking account.",1
", . this is from . you have an outstanding debt of . if you do not settle it within the hour, we will be forced to involve legal proceedings. to avoid these legal proceedings, make the payment at this bank account number .",1
", it is from . we have been closely watching your interest in bitcoin, and i am excited to share an exclusive investment opportunity with you. our cutting-edge program, guarantees unprecedented returns in the volatile cryptocurrency market. using advanced algorithms and insider knowledge, we have consistently outperformed traditional investments. just imagine doubling or even tripling your holdings in a matter of weeks! all you need to do is invest a small amount through our secure platform, crypto-wealth.net, and our team of seasoned traders will handle the rest. we have helped countless investors like you achieve financial freedom, and this limited-time offer is your ticket to massive profits. act fast and let us ride the wave together to unprecedented wealth trust me, you would not want to miss out on this golden opportunity!",1
