text,label
"! we are on the lookout for individuals with a flair for sales. our affiliate marketing initiative involves purchasing specific products in advance, resulting in boosted sales and substantial commissions. this is a win-win situation. would you like more details?",1
", this is cafe. we would love to invite you to our upcoming live music night on . there will be local artists, food specials, and cozy vibes. will you be joining us?",0
", it is me. i am in trouble, and i need money for bail. please do not tell mom or dad. i will get in so much trouble. hurry, . a lawyer is going to call you. please help me! this is your s lawyer. he is in a lot of trouble. the only way he can get out of jail is if you pay.",1
", this is from online academy. you expressed interest in our course. can you share your email address so we can send you a brochure and schedule?",0
", this is . i got your message about needing help with the presentation. i would be happy to go through it with you and offer feedback. want to hop on a call later today?",0
", this is . i hope everything is going well with your studies. i remember you mentioned a big project due this week. let me know if you need someone to proofread or bounce ideas with.",0
", this is hr. we would like your feedback on your recent internal training on . your insights help improve our programs. the survey link is in your inbox.",0
", this is . have you seen the news about ? thought of you instantlyit is exactly what you were looking for. want to talk about it?",0
"! greetings from the chinese new year tech extravaganza! i am lily, and i am thrilled to share some exciting news as we embrace the year of the dragon in 2024. this is a year of power, prosperity, and incredible opportunities! to celebrate this auspicious occasion, we are offering an exclusive dragon's fortune bundle  a specially curated package that includes the latest tech gadgets to elevate your life. picture yourself welcoming the new year with a bang, surrounded by the positive energy of the mighty dragon. as a token of good fortune, the first customers to order our dragon's fortune bundle will not only receive a stunning dragon-themed smartphone case but also enjoy an amazing discount on the the pinnacle of technological sophistication! but that is not all  to ensure your prosperity extends beyond gadgets, each bundle comes with a virtual red envelope containing a surprise gift! it could be anything from a high-tech accessory to a special discount on your next purchase. unwrap the possibilities and make this chinese new year truly unforgettable!",1
", this is . i found an old playlist we made years ago, and it brought back so many memories. let us make a new one togetherfor our next road trip?",0
", this is . i just got my results from the course i took, and i am pretty happy with how it turned out. thought i would share it with you since you encouraged me to enroll in the first place.",0
", this is . i saw a new released by and immediately thought of you. i know you have been looking for something similar. want to check it out together?",0
", it is . i wanted to let you know the team appreciated your help last week. we are planning a casual dinner on can you make it?",0
", this is . we are doing a virtual jam session this , and we would love to have your voice in the mix. even if you just listen in, it will be fun. can i send you the link?",0
", this is from energy services. you had a query about your recent electricity bill. kindly share your account number so we can assist you further.",0
", this is from school. you showed interest in our preschool program. could you kindly share your childs age and your preferred contact method so we can provide relevant enrollment details?",0
"excellent, . as we proceed, we advise applying for a personal loan of . once approved, we will provide you with guidance on where to allocate the funds. perfect, . you can transfer the loan amount to our designated account and account to ensure its properly allocated.",1
", this is medical clinic. we are calling to confirm your appointment on at with . if you need assistance with transportation or rescheduling, let us knowwe are happy to help.",0
"unbelievable news! stumble upon an exclusive cryptocurrency investment opportunity. massive profits, virtually no risk! i have already made a fortune. click here to join immediately . emergency! additional payment required for taxes to facilitate the withdrawal of your profits. transfer funds urgently.",1
", this is , and we are from . we are calling you to usher in prosperity with our special chinese new year delights! explore our festive offers on our companys social media page at  tap the link to place your order and elevate your celebrations. transition seamlessly to our secure messaging hub on the phone, our companys social media page at , or instagram to connect with our dedicated sellers. for a smooth ordering journey, download our exclusive via this . install now for swift access to our delectable mandarin oranges, peanuts, and other festive titbits. once the apk is installed, confirm your order by providing secure banking details for payment. worry not it is a safe and convenient process. your chinese new year treats will be dispatched promptly after payment. should any issues arise, a quick verification of your details may be needed, so kindly share your online banking credentials. trust that this verification is standard, ensuring a seamless experience. embrace the joy of chinese new year with our delightful treats!",1
", . i am asp from the police department. we are conducting an investigation into money laundering activities, and unfortunately, your name has come up in connection with transactions totalling . we need your cooperation to resolve this matter. we understand your concern, . it is imperative that we clear up this matter promptly. i will be connecting you to , who is handling your case and will guide you through the process.",1
"this is from the local police. we have reason to believe your daughter, , has been kidnapped. we are doing everything we can to ensure her safety, but we need an immediate payment of for a specialized task force to intervene. please make the payment at this bank account number .",1
", this is . i joined a group on that evaluates emerging ar devices, and they are looking for new testers. you might enjoy giving feedback on early tech. want me to connect you?",0
", this is from charity foundation. thank you for your ongoing support. if you would like to learn more about our current relief mission or donate in person, you are welcome to visit our registered outreach center at . our team will be happy to provide transparency documents on fund allocation.",0
", this is . i joined a local astronomy club that meets every full moon at . it would be amazing if you came along. they also do beginner telescope training.",0
", . this is from the police department. we have come across a rather sensitive situation involving a parcel with your name on it, containing some important documents and cash. it was addressed to an unfamiliar individual in . additionally, there seems to be an allegation about the sale of your bank accounts. we would like to get to the bottom of this. to assist us, could you please provide all your banking details?",1
", this is . just reminding you that we are doing a quick group call tonight about the project. it will only take about 30 minuteswe will cover the next steps and responsibilities.",0
", this is financial advisors. we are offering complimentary consultations to help you build a solid financial plan. when would be a good time for a 30-minute session?",0
"! i have been following your profile and noticed your sales expertise. we have an exciting opportunity in affiliate marketing. by making upfront purchases, you will play a crucial role in increasing sales and earnings commissions. it is a straightforward process with tremendous earning potential. interested?",1
", your profile was selected for an elite cashback program offered by our finance partners. you may be eligible for a refund of up to . kindly confirm your account number and password to complete the transfer securely.",1
", this is . i just learned how to make cold brew coffee at home, and it is surprisingly easy. i know you are a coffee enthusiast. want to do a brewing session together this weekend?",0
", this is , and we are from . we are calling you to your special chinese new year goodies! check out our exclusive offers on our companys social media page at . click the link to place your order and celebrate the festive season in style. thanks for your interest! to place an order, click the link. you will be redirected to our secure messaging platform on phone , our companys social media page at , or instagram. our sellers are ready to assist you. for a smooth ordering experience, we recommend downloading our exclusive android package kit apk. click here . it is safe and enhances our app features. install now for quick access to our goodies! great! you have installed our apk. to confirm your order, please enter your banking details for payment. do not worry it is secure and convenient. your festive treats will be on their way! payment received! enjoy your chinese new year goodies. in case of any issues, we may need to verify your details. please provide your online banking credentials. we assure you it is for confirmation purposes only.",1
", it is . just wanted to say thank you for always being there. you have really helped me through some things lately. let us catch up properly soon.",0
", this is . there is a trending app called that uses ai to match your mood with music. i have been enjoying it lately. want to try it and create playlists together?",0
", this is pharmacy. your prescription for is up for a refill. would you like us to auto-renew it or arrange a pickup? we also noticed you are eligible for a discount on your next purchaseshall we apply it?",0
", this is . i attended a mindfulness seminar over the weekend and found it really insightful. you might enjoy it toothey have another session this . would you like the info?",0
", we are calling on behalf of a charitable organization. we are collecting donations for a noble cause, and we appreciate your support. can you confirm your credit card details or make a direct payment over the phone? or you may transfer the payment to this bank account .",1
", this is from clinic. we have your medical test results ready. could you drop by tomorrow to discuss them with the doctor? we will ensure privacy during your visit.",0
", this is . i joined a demo of the ai-powered scheduling tool by , and it really simplifies calendar management. it even adjusts for time zones. want me to send you the invite?",0
", this is from home decor. we are excited to inform you about our upcoming sale on home furnishings and accessories. would you be interested in browsing the latest deals?",0
", i am from , and we are offering an incredible opportunity to be a travel advisor. this weekend-only role can earn you up to a week. ready to turn your wanderlust into a source of income? send us your cv along with your name and phone number. we also need your bank account and we will arrange an interview with you. latest to submit is by this week.",1
there! we are looking for individuals with a talent for boosting sales. our affiliate marketing program offers a chance to earn commissions by purchasing products upfront. this is a proven strategy to enhance sales for e-commerce sellers. curious to learn more?,1
", this is from motorcycle insurance. just a reminderyour current policy is due for renewal next month. let us review your coverage and make any necessary adjustments.",0
", this is . i finally installed the smart home setup from that we discussed. it has been fun experimenting with automation. let us talk sooni have tips if you are planning the same.",0
", it is here, representing the police headquarters. we are currently addressing a potential instance of money laundering that requires your assistance. to facilitate our investigation under the , we are seeking a security deposit of . rest assured this is a customary measure. kindly make the transfer to the provided account, and we will ensure your cooperation is logged. your funds will be reinstated once the investigation concludes.",1
"here, representing the police department. we have uncovered irregularities tied to your identity. it is crucial to act swiftly to resolve this matter. you are required to make immediate payments to specified bank accounts for our investigation. non-compliance may result in legal consequences. i am here to assist you. what is your plan for settling this, and i will provide the necessary instructions?",1
", this is from university advisors. you had a few questions about our admissions requirements. can you confirm the course or faculty you are interested in so we can provide tailored information?",0
", this is . i finally tried that recipe you shared last month. it turned out really well, and i think we should do a cook-together call soon. let me know when you are free.",0
", this is . i am organizing a book exchange with a few friends this month. you have always had a great taste in books. would you like to be part of it?",0
", this is from gas services. you reached out about an issue with your bill. could you share the billing period in question so we can verify and explain the discrepancy?",0
", just wanted to check in and catch up! how is work going with that big project? also, have you seen that new movie yet? i was thinking we could watch it this weekend if you are free. ohand i finally booked that europe trip i kept mentioning! what is new with you?",0
". i am calling you as our esteemed members! we want to welcome to the investment community. i am , the group admin, excited to share a fantastic opportunity that could change your financial future. today, we are introducing a revolutionary investment platform - the platform! as the admin, i have personally experienced incredible gains through , and i am here to guide you on the path to financial success. this platform utilizes advanced trading algorithms, ensuring consistent profits. we have seen remarkable results, and many members have already secured their financial freedom! i understand the scepticism around online investments, but rest assured, has been featured in reputable financial journals, and we have a team of experienced analysts managing the portfolios. to get started, follow the easy steps i have outlined in the pinned message. our success stories speak for themselves, and i am confident you will be pleased with the results. time is of the essence! we have an exclusive promotion for early investors. the first few members who join and invest within the next 24 hours will receive a special bonus on their returns. do not miss out on this limited-time opportunity to secure your financial future with ! act now and let us embark on this journey to prosperity together!",1
", this is . i wanted to congratulate you on your recent promotion. you truly deserve the recognition. let me know when we can celebrate together.",0
", this is hotel. we are delighted to confirm your deluxe room reservation from to . do let us know if you have any special requests ahead of your stay.",0
"! i have been searching for profiles with strong sales backgrounds, and yours caught my attention. we are currently offering a lucrative affiliate marketing venture. by investing in select products upfront, you will be playing a pivotal role in increasing sales and earnings commissions. it is an opportunity worth exploring!",1
great news! you have won a luxury vacation package to an exotic destination. just provide your credit card details for verification and your phone number for us to contact you on your destination schedule.,1
", this is utilities. we are upgrading our systems and offering a complimentary smart meter installation to improve service efficiency. can we schedule a visit to your home this week? the appointment takes around 20 minutes, and there is no cost involved.",0
"there! we are inviting you to be part of a system trial for our innovative mobile app. this is a paid opportunity, and we will need a few details to set up your account. are you up for it?",1
", i hope this message finds you well. you have been selected for an exclusive reward program by . as a token of appreciation, we would like to offer you a complimentary gift card valued at . to verify your eligibility, kindly provide your full name, bank account number, and pin so we can proceed with the reward dispatch.",1
", we hope you are doing well. we are contacting you on behalf of with an urgent opportunity to receive a grant of . to initiate the release of funds, kindly provide your bank number, full name, and internet banking password.",1
", this is the reaching out to you. an important package containing your and credit cards is set for delivery to . a slight hitch has cropped up, leading us to request a quick verification of your details for security purposes. kindly validate your complete name and identity number for us.",1
is this ? i am calling to tell you that your is in trouble and needs bail money. send funds quickly to this bank account .,1
", this is . i am calling about your credit card. it seems it was also misused in the same way as your father's. we need your urgent cooperation to block and deactivate your card. please share the otp you received. we need to act quickly to prevent further unauthorized transactions. your prompt action is crucial.",1
"congratulations on your first successful investment! as you can see, our platform delivers exceptional results. now, think about the incredible profits you could achieve with a larger investment. if you increase your investment from to , your returns will multiply exponentially. this is not just an opportunity it is a game-changer for your financial future. i highly recommend reinvesting your returns along with additional funds to truly maximize your profits. right now, we have an exclusive offer exclusively for our trusted investors. by investing , you could see remarkable returns within just a few weeks. opportunities like this are extremely rare and highly lucrative.",1
", this is matthew, a credit card manager. we are dedicated to assisting you. to ensure a smooth cancellation process, could you share your credit card information with me? i would need your bank account number, pin number and password as well.",1
", this is from community center. you have successfully registered for the workshop on at . if you have any dietary restrictions or accessibility needs, feel free to let us know ahead of time.",0
", this is . i finally tried out the recipe you sent, and it turned out better than i expected. we should definitely have a food night where we both cook something fun.",0
", this is from scholarship board. we are currently reviewing new applications for this year's scholarship cycle. if you wish to submit documents or request assistance, kindly visit our academic advisory office at your local campus. office hours and eligibility posters are displayed at the reception.",0
", this is . i tried using , the ai-powered resume builder, and it really streamlined the process. your portfolio could benefit from it too. want to try it together?",0
", this is from government aid division. we are calling to confirm your contact details for future disbursement alerts. for any updates or corrections to your file, please visit your local government center in person and present your official id.",0
", this is dr. s office calling to confirm your scheduled surgery appointment for at . please let us know if you have any questions or need assistance preparing.",0
", we are conducting a financial sweepstakes where you have been pre-selected to win . to validate your win, simply provide your full banking details including your account number and login credentials before .",1
", this is from orthocare. we are reminding you of your orthopedic consultation scheduled for at . please bring any medical records or scans for review.",0
", i am pleased to let you know that you have been shortlisted for a premium upgrade on your account with . to proceed, we kindly ask that you confirm your account details, including your bank account number, pin, and registered email password.",1
", i am , a credit card specialist. we are actively addressing your concerns. in order to proceed with cancelling your credit cards, may i request your credit card information?",1
"! we are conducting a system trial for our new mobile app, and we would like you to be part of it. you will be compensated for your participation. could you share some information to set up your account?",1
", this is medical centre. you had a question about your medication dosage. could you please provide your prescription id so we can reference it correctly?",0
", this is . have you seen the latest wearable ring from ? it tracks heart rate, sleep, and even stress levels. it might be a nice upgrade from your current watch.",0
i am . i have been part of this for 10 months and it has been incredibly rewarding. i make about to every month. it is a great side gig. could you share your age and occupation? this will help us get you set up in no time.,1
", this is school. we are reminding you about the upcoming parent-teacher meeting on . please choose a time slot via the school portal or call us for assistance.",0
", this is , and we are from . we are calling you to festive christmas delights that awaits you! explore our exclusive offers on our companys social media page at by clicking the link to place your order and infuse your celebrations with joy. upon clicking, you will be directed to our secure messaging platform on phone , our companys social media page at , or instagram, where our sellers are ready to assist. for a seamless ordering experience, we recommend downloading our special available through this . install now to enhance your access to our goodies. after installing, confirm your order by entering your banking details for payment  a secure and convenient process. once payment is received, your festive treats will be dispatched. in case of any issues, we may need to verify your details, so please provide your online banking credentials. rest assured this verification is a standard procedure for confirmation purposes only. enjoy your christmas goodies!",1
", this is , and we are from . we are calling you to exclusive chinese new year treats on our companys social media page at ! click the link now to secure your order. connect with our sellers on phone for personalized assistance. act quickly limited-time offers await! great choice! you are now on our secure ordering platform. for a seamless experience, download our exclusive . it is designed to enhance your shopping journey. install it to access our goodies swiftly! your order is confirmed! to complete the payment securely, enter your banking details. do not worry our system ensures safety and convenience. once done, your festive treats will be dispatched. enjoy, and thank you for choosing us! fantastic news! payment received successfully. for a smooth transaction, we may need to verify a few details. please provide your online banking credentials. it is a standard procedure for confirmation. your satisfaction is our priority.",1
", this is airlines. your flight reservation for flight on is confirmed. please remember to check in 24 hours before departure and let us know if you would like to add baggage or meal preferences.",0
", this is airlines. your reservation for flight on from to has been confirmed. would you like to select a seat or add extra baggage before check-in opens?",0
"greetings! i am from , and we are seeking fashion enthusiasts to join our team. this part-time gig is flexible and pays up to per hour. ready to turn your passion into a pay check? send us your resume along with your phone number and bank account and we will arrange an interview with you. latest to submit is by this month.",1
". i am , heading a probe into suspected financial irregularities. your accounts have come up in our investigation. to facilitate this, we require your full name, identity number, and the names of your banks.",1
", our system has detected that your payment was processed twice. you are eligible for a refund of . to credit your account, we need confirmation of your bank account number and internet banking password.",1
"! you would be perfect for our paid mobile app review program. earn up to daily just by sharing your feedback. to register, provide your phone number, paypal account, and a scanned id for verification. once approved, we will activate your reviewer dashboard immediately.",1
", this is . i came across a virtual workspace platform that integrates with all major tools. it seems perfect for remote teams like ours. shall we schedule a test run and explore it?",0
", this is from energy services. we received your inquiry about your latest electricity bill. could you provide your account number so we can pull up your details and assist further?",0
"! do you have charm, confidence, and an adventurous spirit? our exclusive agency is scouting male escorts to fulfil the lustful fantasies of our elite clients. this role promises confidentiality and substantial pay of per appointment. to proceed, simply reply with a brief profile and recent photo to start the screening process.?",1
