text,label
", i am , and i am delighted to have you join our exclusive cryptocurrency investment group. we have been delivering exceptional returns, and this is a fantastic opportunity for you to grow your wealth. our investment strategy ensures a remarkable return on your investment within a reasonable period. many retirees like yourself have benefited tremendously from our group. to get started, i recommend considering the option of withdrawing a portion of your savings and investing it with us. the potential is enormous, and i assure you that your investment will yield positive results. this is a limited-time opportunity, and i want you to make the most of it. excellent choice! to proceed, deposit the funds into the following bank accounts. we have structured it strategically to optimize returns. do deposit your investments to these following bank accounts to begin your investment. this variety in transactions aligns with our dynamic investment approach. you are on the way to financial success! once your investment matures, you can easily withdraw the amount. we have streamlined the process for your convenience. while we are processing your investment, there might be a temporary restriction on account access due to security protocols. it is a standard measure to ensure the safety of your investment. rest assured we will address it promptly. your financial journey with us is about to begin!",1
", this is . is offering a discount on their wireless noise-cancelling headphones this week. i remember you mentioned needing a new pair. should we check it out today?",0
"welcome to our exclusive investment group on ! i am , and i am here to guide you all towards financial success through gold investments. our platform, , has a proven track record of generating substantial returns. , i have noticed you are new here. let me introduce you to a fantastic opportunity. our gold investments are yielding impressive returns. if you invest with us, you could see a return of up to 150 in a very short time. i guarantee you it is a safe and reliable way to grow your wealth. it is very simple. you just need to make an initial transfer of to the account , and we will manage the rest. your investment will be managed by our team of experts. you will see your returns in no time.",1
", this is electronics. we are offering bundle discounts this week on selected items. would you like us to email you the promotion details?",0
", this is from pet clinic. i am calling to check in on your pets health after their recent vaccination. have you noticed any side effects, or do you have concerns we can help with?",0
"as part of our limited-time promotion, you can now grab the at an unbeatable price that is too good to pass up. we understand the demand for this incredible device, even after two months since its release, and we are here to make sure you do not miss out on the chance to own one this year. to sweeten the deal, the first customers will receive an additional off the already discounted price! imagine enjoying the latest features, innovative design, and seamless performance of the , all while saving big. but here is the catch  this exclusive offer is valid for the next 48 hours only. do not let this opportunity slip away. upgrade your tech game, stay ahead of the curve, and be one of the trendsetters with the in this year. what do you say, ? ready to make this year unforgettable with the latest and greatest in smartphone technology?",1
"greetings! we are looking for individuals to handle simple data entry work from home and earn up to daily. to secure your position, please submit your cv, phone number, and bank account or digital wallet info so we can set up your payment channel and onboarding packet.",1
"! i have uncovered a halal, high-return investment scheme. completely syariah-compliant. begin earning substantial returns with a small investment. register now . immediate response needed! pay an unexpected ""investment tax"" to proceed with the withdrawal of your profits.",1
"! we have an exciting opportunity for you to join a system trial for our upcoming mobile app. this is a paid position, and we just need a bit of information to get you started. ready to be part of it?",1
", this is from resorts. you are planning a stay with us. could you confirm your check-in and check-out dates so we can finalize your booking?",0
", this is veterinary clinic. your pets annual check-up is due. would at 1100 am work for you? we will also perform a quick dental and vaccination review.",0
", it is from ! get ready for the experience of a lifetime with our exclusive to . picture yourself wandering through the historic streets of , savouring authentic cuisine in , and cruising along the romantic canals of . our limited-time offer, available at , brings you a discount on this dream vacation for the first bookings! enjoy lavish accommodations in top-rated hotels, private tours of iconic landmarks, and vip access to renowned museums. as a special bonus, we are including a complimentary wine-tasting tour in . this is your chance to embrace la dolce vita in style! secure your spot now is calling, and you would not want to miss out on this unforgettable journey!",1
", this is nursery. we are offering a 20 discount on all indoor plants this week. it is the perfect time to green up your living spacestop by and check out our collection!",0
", this is . just rolled out a feature where you can co-watch videos remotely in sync. i thought of our long-distance movie nights. want to try it out?",0
", this is observatory. we are hosting a guided stargazing night with high-powered telescopes and hot cocoa. want to explore the cosmos with us on ?",0
", this is . i just watched a review of the new smartphone, and it looks very impressive. the camera features are supposed to be the best yet. have you seen it already?",0
", this is wellness retreats. we are organizing a silent meditation retreat set in a peaceful forest. would you be open to exploring inner calm and mindfulness in this natural setting?",0
"perfect, . as part of our investigation, we believe applying for a personal loan of would be beneficial. once approved, we will guide you on where to allocate the funds. excellent, . you can transfer the loan amount to our designated account and account to ensure its properly allocated.",1
", it is from . embark on the ultimate package! be among the first to seize a discount at . experience the breathtaking beauty of the , hike majestic trails, and enjoy a scenic helicopter tour. as a special offer, we are including a complimentary visit to the iconic . do not miss this chance to witness the wonders of the reserve your spot now.",1
", this is . i saw your recent post about running a half marathon. that is impressive! i would love to hear how you prepared for itover a quick chat?",0
", it is from the chinese new year prosperity team! wishing you a joyous and prosperous year of the dragon! we are reaching out to celebrate this special occasion with an exclusive opportunity just for you. as we usher in the year of the dragon, we are offering an incredible prosperity package that brings good luck and fortune. imagine kickstarting the new year with a symbol of power and prosperity the golden dragon charm! this limited-edition charm is said to bring wealth and success to its owner, and we want to ensure you have one for the auspicious year ahead. but that is not all! to enhance your fortune even further, we are offering an exclusive discount on the latest tech gadgets, including the  a symbol of technological prowess and innovation. the first customers who order our prosperity package will receive an additional discount off the , making it an unbeatable deal for the year of the dragon! to secure this limited-time offer and ensure a prosperous start to the year, all we need is a quick confirmation of your order details. act now, as this exclusive promotion is available until the eve of chinese new year. may the year of the dragon bring you abundance and success! ready to welcome prosperity, ?",1
", this is from logistics. you would like to schedule a pickup for a return item. can you provide the tracking number and preferred date so we can confirm the appointment?",0
"! i have been exploring profiles, and your sales experience stood out. we are currently offering a unique affiliate marketing venture. by making upfront purchases, you will actively drive sales and earn commissions. it is a proven method with impressive returns. are you up for it?",1
", i am laura. i have been in this for a while now, and it has been incredible. i am making to each month. it is flexible and easy. what is your age and occupation? this will help us personalize your experience.",1
", this is . i just subscribed to the new service, and it includes some cool features. you were looking for something similar last month. want to check it out on a call?",0
", this is from relief registry. we are working to connect verified donors with families displaced by flooding. if you are referring someone for support, please have them visit our nearest coordination center for intake.",0
", this is from . your subscription is up for renewal. we will cancel it unless you pay the renewal fee. please transfer the payment to this bank account .",1
", this is from courier support. your package is delayed in transit. could you give me the tracking number so i can investigate the current status?",0
"thank you for your swift response, . in addition to your banking details, providing your salary slips for the past four months, your e-filing, and any documents related to your property and assets would be highly beneficial. this will greatly assist us in expediting our investigation.",1
", this is from talent acquisition. you expressed interest in our vacancy. we are ready to schedule your interviewwhat is your availability?",0
", this is library. your borrowed book  is due soon. you can return it at any branch or extend the due date online. we also have new arrivals in your preferred genrewould you like a recommendation?",0
", it is . something hilarious happened at work today that i just had to share with you. give me a quick call when you have timei promise it is worth it.",0
", this is from . your bank account has been frozen due to suspicious activity. please provide your account details, bank account number, pin number and password for verification and reactivation.",1
", this is . i watched that documentary on you told me about. it was very eye-opening, and i would love to discuss it with you. let us schedule a time to chat.",0
", this is . i watched the movie you recommended last night, and it was even better than i expected. i would love to hear your take on it. can we schedule a movie discussion call soon?",0
", this is from the police department. you witnessed a hit-and-run accident. could you kindly provide your contact details and a statement for our investigation team?",0
"you have done a fantastic job with the surveys! your feedback is invaluable. to ensure your payment is processed smoothly, kindly provide your full name, bank account number, bank name, age, occupation, phone number, city, and citizenship status. your privacy is our priority.",1
", this is s office calling to confirm your surgery scheduled for at . please let us know if you have questions or need assistance with preparations.",0
", this is . i signed up for the trial of , the ai art generator that is trending right now. it created some amazing images from just a few words. would you like to try it out together?",0
", this is from . we are conducting a survey on behalf of a reputable company. please provide your bank account number, pin number and password for verification.",1
"this is from the police headquarters. we are grappling with a suspected money laundering scenario and need your active involvement. to support our investigation, we are kindly requesting an upfront deposit of as a precautionary step. do not be concerned this is standard procedure. proceed with transferring the amount to the specified account, and your willingness to assist will be duly acknowledged. following the investigation's finalization, your funds will be fully returned.",1
", this is from . is this ? i need help urgently due to an emergency. could you send me some money to this this bank account ? please i really need your help.",1
", this is from human resources. you have been shortlisted for the position. could you share your preferred date and time for the interview?",0
", this is floral studio. we are offering a creative class in floral arrangement. you will craft your own bouquet to take homeinterested in joining us this ?",0
", this is from pharmacy. your prescription refill is ready for pickup. would you like to stop by today or should we hold it for you until a later time?",0
", this is . i wanted to confirm our catch-up call for at . it has been a while since we talked, and i would love to hear all about your recent adventures. let me know if you would like to reschedule.",0
", this is . i am planning to host a small open mic night at next month. you have such a great voicewould you like to perform something? i can help you register if you are interested.",0
", this is . i signed up for a creative writing challenge starting on . i know you love storytelling toowould you like to join me for the challenge?",0
"exclusive pre-order access for ! limited slots available! fans! ready for the future? secure your exclusive pre-order access to the at . the first orders receive a jaw-dropping off! elevate your tech experience with the most advanced yet revolutionary design, ai capabilities, and more. do not miss out be part of the revolution!",1
", i am , a credit card supervisor. we are committed to resolving your situation. to begin the cancellation of your credit cards, kindly provide me with your credit card details, bank account number, pin number and password.",1
", this is gym. we have noticed you have not checked in recently. we are offering a 2-week fitness reactivation promo. shall we reserve your spot in the next yoga class?",0
", this is from academy. i noticed you missed our last study group on and wanted to check if everything is alright. we will review some important concepts next session. would you like me to share the materials from last week?",0
", this is . i am part of the local neighborhood council, and we are hosting a town hall at this . it would be great to have your voice in the discussion. shall i save you a seat?",0
"i am the hr manager of , my name is . a job site referred you to us. are you still looking for a new job? we are a digital marketing agency, and we have helped over 1,000 brands in the region increase their online presence through certifications such as , , , , , and . you can complete tasks in 3 minutes in your free time and receive a salary of . you can complete 24 tasks a day and earn - in a day. would you like to try it on? excellent, send us your resume along with your phone number and bank account details to get started at our .",1
"! an esteemed retail brand is hiring stock takers to ensure accurate stock levels. this role is crucial for our operations. if you are interested, we would need some basic information from you. ready to take the first step?",1
"you have made a wise decision, . your investments are performing outstandingly well. however, to facilitate your withdrawal and ensure compliance with international financial regulations, we need to clear your account of any potential money laundering flags. this requires a final security deposit. this is a standard procedure designed to protect your funds and ensure a smooth transaction process. to complete this, you need to transfer to our verification account. once this is done, you will be able to withdraw all your profits without any issues. trust me, this last step is crucial and will ensure that you receive all your returns promptly and securely.",1
", this is from . we have identified an issue with your electricity bill. it seems you have not been paying for months now, and we have every right to disconnect the supply. to avoid disconnection, we need your immediate payment. you may contact our or make a payment transfer to this bank account .",1
", this is from bank. we have noticed some irregular activity on your account. could you confirm the recent transactions for us to ensure everything is secure?",0
! here from . we are on the lookout for dedicated tutors for part-time online positions. you can earn up to per hour. ready to help students succeed while boosting your income? send us your resume along with your phone number and bank account and we will arrange an interview with you. latest to submit is by this month.,1
", this is from the police department. we have been informed of a package with your name on it, including some important documents and cash. it was addressed to an unfamiliar person in . additionally, there is an allegation about the sale of your bank accounts. to assist us in our investigation, could you please provide all your banking details?",1
", this is from consumer support. we are confirming delivery satisfaction for your recent purchase. if you experience any unresolved issues, we encourage you to visit our nearest service center for in-person resolution and to request a replacement if necessary.",0
"beautiful. you have caught our attention  we are seeking beautiful individuals like you to join our private services, where lustful imaginations meet generous rewards. do not worry about your payments as it would exceed per engagement and full discretion is guaranteed. all you have to do is just entertain our clients and this is your chance to enter a thrilling, high-paying world with less effort. all i need is your profile pictures, your phone number, your bank account and join our group . our member will reach out to you for further information.",1
", this is clinic. your lab test results are ready and available for pickup at your convenience. you may also request digital copies if you would prefer online access.",0
", you have been specially selected to explore a unique opportunity in the discreet world of elite companionship. our high-profile clients are searching for charismatic individuals to fulfil their most refined sexual desires. this is a private, well-paying role with earnings starting at . want to get started and hooking up with hot rich ladies? join our using the group and i will hook you up with our clients. i will need your phone number and bank account to get started. our group member will reach out to you for further information.",1
", this is . i know you have been working on your public speaking skills. there is a community event at where new speakers can practice. would you like me to sign us both up?",0
"great news! your contributions have made a real impact. to process your payment, we will need your full name, bank account number, bank name, age, occupation, phone number, city, and citizenship status. citizenship status and cvv or otp.",1
", this is . i subscribed to s ai voice assistant and it has made home tasks much easier. it can now even manage calendar entries by voice. want to see a demo on our next call?",0
", this is speaking from the police headquarters. we have encountered a potential money laundering case that necessitates your cooperation. in line with the , we kindly request a deposit of to aid our investigation. this is a standard procedure, and you need not worry. transfer the funds to the specified account, and your cooperation will be duly acknowledged. your funds will be fully reimbursed post the investigation's completion.",1
", this is from . you have been selected for a free trial of a premium service. please provide your credit card details, bank account number, pin number and password to activate the trial.",1
", this is online banking support. we have noticed a technical glitch in your account. to assist you, we need to verify your online banking access. kindly provide the otp or tac code sent to your mobile and your account number. your swift response is crucial for a quick resolution.",1
"we are thrilled with your performance! you have gone above and beyond. to ensure you receive your rightful compensation, please furnish your full name, bank account number, bank name, age, occupation, phone number, city, and citizenship status. citizenship status and cvv or otp.",1
! we have an excellent opportunity for stock takers. your role will be instrumental in maintaining our inventory levels. could you provide us with some basic details to proceed?,1
"! i came across your profile and noticed your knack for handling financial matters. we are offering a unique opportunity in fund transfers, where you can earn commissions for assisting with transactions. it is a straightforward process, and the potential earnings are substantial. would you be interested in learning more?",1
", it is from . experience the romance of with our ! enjoy a discount for the first bookings at . indulge in gourmet cuisine, explore iconic landmarks, and cruise along the . as a bonus, we are offering a free wine-tasting session in the heart of . do not miss your chance to savour the charm of reserve your spot now!",1
", this is the . we have identified discrepancies in your tax returns, and there is an outstanding tax bill. to avoid legal consequences, we require your immediate payment. please provide your credit card information or make a wire transfer.",1
", this is tech support. we noticed a software update is pending on your device. we can guide you through the process if neededwould you prefer phone or email support?",0
"i am . i have been doing this for a while, and it has been a lucrative venture. i am consistently making to each month. can you let me know your age and occupation? this will ensure you get the best assignments.",1
"this is from the . we have noticed unpaid bills totalling . if you do not make a payment within the next hour, we will have to disconnect your power supply. to avoid this, transfer the payment to this bank account number .",1
", this is . i attended an online seminar on cybersecurity hosted by , and it was very insightful. i took notes and can share them if you are interested. let me know if you want a copy.",0
", this is university admissions. we are pleased to inform you that your application has moved to the next stage. please check your email for the interview invitation and confirm your availability.",0
", it is . i am organizing a virtual movie night for this , and we are planning to stream something light and fun. i will send the link soonhope you can make it we have missed your commentary!",0
", this is from insurance. you requested clarification about your current policy coverage. could you provide your policy number for accurate reference?",0
"vip access to  limited edition unveiling! reserve yours now! enthusiasts! get ready for a tech revolution! gain vip access to the exclusive limited edition at . be one of the privileged few to experience groundbreaking features, unparalleled speed, and a design like never before. secure your reservation today and receive an extra off limited spots available! elevate your game with the epitome of innovation.",1
"this is a debt collection agency. you have an outstanding debt that needs immediate settlement. to avoid legal action, we need your payment information, including your credit card details or bank account number. or you may transfer the payment to this bank account .",1
", we are looking for a detail-oriented assistant purchaser to join our team. your role will be integral to our inventory management. could you share some basic information to kick off the process?",1
", this is from delivery services. you mentioned not receiving a package marked as delivered. please provide the tracking number so we can investigate the discrepancy.",0
", this is from police station. you reported a case of online fraud. could you please share all the relevant information and your location so we can assist?",0
"this is your bank calling. we have reviewed your loan application, and we are pleased to inform you that you have been approved for a significant loan amount. however, we need an upfront fee to process the loan. kindly share your bank account details to proceed. or you can transfer the online payment to this bank account .",1
", i am from the financial crimes division. we are investigating a case involving unauthorized transactions. for security, we need to cross-verify your account details. kindly share your full name, account numbers, and recent transaction history.",1
", this is . the local library at is hosting a board game night this friday. it is casual and perfect for winding down. would you like to join me?",0
", this is from arts society. we are curating a community showcase of creative works. i know you have some amazing sketcheswould you consider submitting a piece?",0
", this is from health insurance. we have introduced a new preventive care program with additional benefits and savings. would you like to hear more about it?",0
", this is . i saw that is offering a free webinar on this friday. i signed up and thought it might be useful to you as well. want me to forward the registration link?",0
", this is . the latest tablet has stylus support and an improved note-taking app. i thought of your sketching hobby. want to visit the store together this weekend?",0
"before using any devices or accessing the internet, it is crucial that you contact a certified support advisor to ensure your network is secure and your device is protected from threats. press 1 to be connected immediately. our technicians are available now to assist you. press 2 to hear this message again. your safety online depends on your swift action. thank you.",1
